<?xml version="1.0" encoding="UTF-8"?>
<xs:schema xmlns:xs="http://www.w3.org/2001/XMLSchema">

    <xs:element name="Flowers">
        <xs:complexType>
            <xs:sequence>
                <xs:element name="Plant" maxOccurs="unbounded">
                    <xs:complexType>
                        <xs:sequence>
                            <xs:element name="Name" type="xs:string"/>
                            <xs:element name="Soil" type="SoilType"/>
                            <xs:element name="Origin" type="xs:string"/>
                            <xs:element name="VisualParameters">
                                <xs:complexType>
                                    <xs:sequence>
                                        <xs:element name="StemColor" type="xs:string"/>
                                        <xs:element name="LeafColor" type="xs:string"/>
                                        <xs:element name="Size" type="SizeType"/>
                                    </xs:sequence>
                                </xs:complexType>
                            </xs:element>
                            <xs:element name="GrowingTips">
                                <xs:complexType>
                                    <xs:sequence>
                                        <xs:element name="Temperature" type="xs:int"/>
                                        <xs:element name="Lighting" type="xs:boolean"/>
                                        <xs:element name="Watering" type="xs:int"/>
                                    </xs:sequence>
                                </xs:complexType>
                            </xs:element>
                            <xs:element name="Multiplying" type="MultiplyingType"/>
                            <xs:element name="DateOfAdmission" type="xs:date"/>
                        </xs:sequence>
                        <xs:attribute name="id" type="xs:ID" use="required"/>
                    </xs:complexType>
                </xs:element>
            </xs:sequence>
        </xs:complexType>
    </xs:element>

    <xs:simpleType name="SoilType">
        <xs:restriction base="xs:string">
            <xs:enumeration value="Loamy"/>
            <xs:enumeration value="Sandy"/>
            <xs:enumeration value="Ground"/>
        </xs:restriction>
    </xs:simpleType>

    <xs:simpleType name="SizeType">
        <xs:restriction base="xs:string">
            <xs:enumeration value="Small"/>
            <xs:enumeration value="Medium"/>
            <xs:enumeration value="Large"/>
        </xs:restriction>
    </xs:simpleType>

    <xs:simpleType name="MultiplyingType">
        <xs:restriction base="xs:string">
            <xs:enumeration value="Spores"/>
            <xs:enumeration value="Cuttings"/>
            <xs:enumeration value="Seeds"/>
            <xs:enumeration value="Bulbs"/>
        </xs:restriction>
    </xs:simpleType>

</xs:schema>